year,level,subject,paper,question,text,coleman_liau,flesch_kincaid,gunning_fog,total_tokens,positive_tokens,negative_tokens,neutral_tokens,compound_sentiment_score,intent,intent_certainty,named_entities
1948,Higher Grade,ENGLISH,1,,The difficulty of choosing Christmas presents.,11.83,6.8,9.07,4,0,1,3,-0.34,describe,0.6430085301399231,"('Christmas', 'DATE', 1)"
1948,Higher Grade,ENGLISH,1,,"“There is no accounting for tastes.” With this proverb in mind, write an essay as if you were one of the following caterers to the public: a programme official of the B.B.C.; a manager of a cinema; a librarian in a public library; a restaurant keeper.",8.86,6.9,9.6,20,0,0,20,0.0,describe,0.4792983531951904,"('one', 'NUMBER', 1)('manager', 'TITLE', 1)('librarian', 'TITLE', 1)"
1948,Higher Grade,ENGLISH,1,,A description ,11.63,8.8,20.8,1,0,0,1,0.0,describe,0.4645046889781952,
1948,Higher Grade,ENGLISH,1,,"eal or imaginary) of one of the following: a snowstorm, a shipwreck, a destructive fire, a flood.",8.0,7.6,11.51,9,0,2,7,-0.4762,discuss,0.4375102818012237,"('one', 'NUMBER', 1)('fire', 'CAUSE_OF_DEATH', 1)('flood', 'CAUSE_OF_DEATH', 1)"
1948,Higher Grade,ENGLISH,1,,"What local question is causing discussion in your district? State the question at issue clearly and impartially, and give some of the chief arguments on both sides.",9.57,6.2,9.84,14,1,1,12,0.0203499999999999,compare,0.474069744348526,
1948,Higher Grade,ENGLISH,1,,"A letter recommending one or more hobbies, with reasons for the choice, to one of the following: a boy or girl fond of living things; a boy or girl living in a remote and lonely place; a boy or girl who is clever with his or her hands; a boy or girl with an interest in history or geography.",8.44,22.8,24.28,28,4,1,23,0.2981399999999999,describe,0.6659721732139587,"('one', 'NUMBER', 2)"
