year,level,subject,paper,question,text,coleman_liau,flesch_kincaid,gunning_fog,total_tokens,positive_tokens,negative_tokens,neutral_tokens,compound_sentiment_score,intent,intent_certainty,named_entities
1930,HIGHER GRADE,ENGLISH,2,,Read the following passage through and then answer the questions: What faults are here imputed to British commerce? What reasons are suggested for the existence of these faults? What means are suggested for removing them? And what benefits would flow from their removal?,8.58,6.3,8.97,20,1,2,17,-0.1149999999999999,compare,0.949026346206665,"('British', 'NATIONALITY', 1)"
1930,HIGHER GRADE,ENGLISH,2,,"Explain the metaphor in ""handicapped,"" and point out where the same metaphor is repeated later in the passage.",8.92,8.0,9.42,8,0,0,8,0.0,reason,0.645116925239563,
1930,HIGHER GRADE,ENGLISH,2,,"Give the exact meaning of the following words and phrases as used in this passage, adding the derivation of the words printed in italics: commercial expansion, a telling indictment, lethargy, complacent assumption, taxed, adaptability, materially, alleviate.",13.76,20.9,25.51,24,0,2,22,-0.2086,discuss,0.8202791810035706,
1930,HIGHER GRADE,ENGLISH,2,,Read the following lines carefully and then answer the questions: Give the substance of Sarpedon’s argument in your own words; explain the last two lines fully.,9.18,9.9,11.94,16,1,1,14,-0.1166,reason,0.3781518638134002,"('Sarpedon', 'PERSON', 1)('two', 'NUMBER', 1)"
1930,HIGHER GRADE,ENGLISH,2,,"Comment on the use of—fearful, dare, fighting—in this passage. Give the exact meaning, and if you can the derivation, of—elude, lust, inexorable, doom, bestow.",11.47,8.0,8.13,15,0,1,14,-0.4019,describe,0.7361933588981628,
1930,HIGHER GRADE,ENGLISH,2,,Who do you think wrote these lines? On what grounds of style and metre is your conclusion based?,9.35,0.9,5.82,8,0,0,8,0.0,compare,0.5880782604217529,
1930,HIGHER GRADE,ENGLISH,2,,"Rewrite the following passage from Ben Jonson in good modern English, eliminating all archaisms of vocabulary, accidence, syntax or order.",12.52,14.6,16.0,14,1,0,13,0.4404,reason,0.702155351638794,"('Ben Jonson', 'PERSON', 1)('modern', 'MISC', 1)('English', 'NATIONALITY', 1)"
1930,HIGHER GRADE,ENGLISH,2,,"Quote, or invent, a sentence to illustrate each of the following: inversion, alliteration, apostrophe, irony.",11.75,12.7,14.0,9,1,1,7,0.0128,discuss,0.8405788540840149,
1930,HIGHER GRADE,ENGLISH,2,,"From what source, and about what date, did English borrow each of these words: chivalry, algebra, sepoy, garage?",8.92,6.8,7.2,9,0,0,9,0.0,describe,0.5872671604156494,"('English', 'NATIONALITY', 1)"
