year,level,subject,paper,question,text,coleman_liau,flesch_kincaid,gunning_fog,total_tokens,positive_tokens,negative_tokens,neutral_tokens,compound_sentiment_score,intent,intent_certainty,named_entities
1932,LOWER GRADE,GEOGRAPHY,1,,"On the accompanying map of part of the British Isles: Outline, shade, and name two large areas of very dense population. Outline and name areas too high for population ",7.62,6.6,8.56,18,0,0,18,0.0,discuss,0.9661849141120912,"('British', 'NATIONALITY', 1)('Isles', 'LOCATION', 1)('two', 'NUMBER', 1)"
1932,LOWER GRADE,GEOGRAPHY,1,,eglect Ireland). Insert railway routes and towns.,13.17,3.7,2.8,6,0,0,6,0.0,describe,0.3869154155254364,"('Ireland', 'COUNTRY', 1)"
1932,LOWER GRADE,GEOGRAPHY,1,,On the accompanying map of the World: Name geographical features and mark key locations. Print names of races/animals over their habitats. Complete mapping tasks related to coordinates and antipodes.,11.74,9.4,13.54,19,0,0,19,0.0,argue,0.3524562120437622,"('World', 'MISC', 1)(':', 'MISC', 1)('Name', 'MISC', 1)"
1932,LOWER GRADE,GEOGRAPHY,1,,"State the latitude, longitude, average annual rainfall, and temperatures of your school district. Explain how elevation changes would affect these.",12.03,10.7,16.0,14,0,0,14,0.0,describe,0.4014438986778259,"('annual', 'SET', 1)"
1932,LOWER GRADE,GEOGRAPHY,1,,"Describe the scenery and attractions of Skye versus the Isle of Wight, including travel routes from Edinburgh.",13.77,7.6,13.86,11,1,0,10,0.4588,reason,0.8196524381637573,"('Wight', 'PERSON', 1)('Edinburgh', 'CITY', 1)"
1932,LOWER GRADE,GEOGRAPHY,1,,"Draw a sketch-map of Fife showing uplands, agricultural regions, and mining areas. Name two market towns and two mining centers.",11.24,7.2,6.0,16,0,0,16,0.0,discuss,0.7986658811569214,"('Fife', 'MISC', 1)('two', 'NUMBER', 2)"
1932,LOWER GRADE,GEOGRAPHY,1,,"Explain the main commodities traded between British ports and Irish cities (Limerick, Cork, Belfast).",14.48,9.9,11.31,11,0,0,11,0.0,reason,0.4583483934402466,"('British', 'NATIONALITY', 1)('Irish', 'NATIONALITY', 1)('Limerick', 'CITY', 1)('Cork', 'PERSON', 1)('Belfast', 'CITY', 1)"
