year,level,subject,paper,question,text,coleman_liau,flesch_kincaid,gunning_fog,total_tokens,positive_tokens,negative_tokens,neutral_tokens,compound_sentiment_score,intent,intent_certainty,named_entities
1939,HIGHER GRADE,ENGLISH,3,,"How far does Shakespeare mean us to sympathise with, and how far does he mean us to blame, any one of the following: Shylock, Brutus, Macbeth, Ophelia, Lear, Coriolanus, Richard II, Caliban, Malvolio? Discuss and illustrate this statement: “In his comedies Shakespeare was kinder to his young women than to his young men. They have fewer faults and more sense.” Describe any comic scene occurring in a Shakespearian tragedy. What purpose do you think is served by its introduction?",9.62,5.9,8.85,44,2,4,38,-0.1705333333333333,discuss,0.7278151512145996,"('Shakespeare', 'PERSON', 2)('one', 'NUMBER', 1)('Brutus', 'PERSON', 1)('Macbeth', 'PERSON', 1)('Ophelia', 'PERSON', 1)('Lear', 'PERSON', 1)('Richard II', 'PERSON', 1)('Caliban', 'LOCATION', 1)('Malvolio', 'PERSON', 1)('Shakespearian', 'MISC', 1)"
1939,HIGHER GRADE,ENGLISH,3,,"Give the names of all the clerical pilgrims in the Prologue to The Canterbury Tales, and briefly describe the character of one of them. What claim has Chaucer to be called the Father of English Poetry?",9.79,8.0,10.53,17,0,0,17,0.0,discuss,0.3295202851295471,"('one', 'NUMBER', 1)('Chaucer', 'PERSON', 1)('English', 'NATIONALITY', 1)('Poetry', 'MISC', 1)"
1939,HIGHER GRADE,ENGLISH,3,,"Comment briefly on any three of the following, giving in each case the author and his approximate date: L’Allegro, Alexander’s Feast, The Rape of the Lock, John Gilpin, Tam O’Shanter, The Lay of the Last Minstrel, Kubla Khan, The Lady of Shalott, Thyrsis, Lepanto.",11.56,16.9,19.42,27,1,1,25,-0.1753999999999999,argue,0.4201916754245758,"('three', 'NUMBER', 1)('author', 'TITLE', 1)('Alexander', 'PERSON', 1)('John Gilpin', 'PERSON', 1)('Tam O’Shanter', 'PERSON', 1)('Kubla Khan', 'PERSON', 1)('Shalott', 'LOCATION', 1)('Thyrsis', 'LOCATION', 1)('Lepanto', 'ORGANIZATION', 1)"
1939,HIGHER GRADE,ENGLISH,3,,Discuss and illustrate by quotation the patriotic element in the poetry of Burns.,12.78,10.7,14.43,7,0,0,7,0.0,reason,0.9896260499954224,"('patriotic', 'MISC', 1)('Burns', 'CAUSE_OF_DEATH', 1)"
1939,HIGHER GRADE,ENGLISH,3,,"Describe briefly the plot and the setting of a novel, either by Scott or by Stevenson, dealing with Scottish life.",10.16,7.6,8.0,11,1,0,10,0.3182,discuss,0.6352852582931519,"('Scott', 'PERSON', 1)('Stevenson', 'PERSON', 1)('Scottish', 'NATIONALITY', 1)"
1939,HIGHER GRADE,ENGLISH,3,,“Wordsworth exalted and transfigured the natural and the common.” Discuss this statement and illustrate it from your reading.,11.1,6.8,10.27,9,1,0,8,0.3612,discuss,0.3577712774276733,"('Wordsworth', 'PERSON', 1)"
1939,HIGHER GRADE,ENGLISH,3,,"Select an essay written by one of the following authors and briefly describe its subject matter and style: Bacon, Addison, Lamb, Hazlitt, Macaulay. What do you know of one of the following: Christian, Isaac of York, Mr. Micawber, Beatrix Esmond, Romola, Father Brown?",9.85,8.9,8.51,29,1,0,28,0.0258,describe,0.7271069884300232,"('one', 'NUMBER', 2)('Bacon', 'PERSON', 1)('Addison', 'PERSON', 1)('Hazlitt', 'PERSON', 1)('Macaulay', 'PERSON', 1)('Christian', 'RELIGION', 1)('Isaac of York', 'PERSON', 1)('Micawber', 'PERSON', 1)('Beatrix Esmond', 'PERSON', 1)('Brown', 'PERSON', 1)"
1939,HIGHER GRADE,ENGLISH,3,,"Give an account of any book you have read dealing with Scientific Research, Exploration, or Mechanical Invention.",10.05,12.3,16.21,10,1,0,9,0.2263,reason,0.4455208480358124,"('Scientific', 'ORGANIZATION', 1)('Research', 'ORGANIZATION', 1)('Mechanical', 'MISC', 1)('Invention', 'MISC', 1)"
