year,level,subject,paper,question,text,coleman_liau,flesch_kincaid,gunning_fog,total_tokens,positive_tokens,negative_tokens,neutral_tokens,compound_sentiment_score,intent,intent_certainty,named_entities
1946,LOWER GRADE,HISTORY,1,,"Alfred the Great, William the Conqueror, Henry II—describe what any one of these kings did for England.",10.98,7.6,11.51,9,1,0,8,0.6249,discuss,0.7987692952156067,"('Alfred the Great', 'PERSON', 1)('William', 'PERSON', 1)('Henry II', 'PERSON', 1)('one', 'NUMBER', 1)('England', 'COUNTRY', 1)"
1946,LOWER GRADE,HISTORY,1,,Trace the chief stages in the Scottish War of Independence from 1296 to 1328 and explain the principal effects of this war upon Scotland.,10.09,10.3,12.93,14,0,2,12,-0.5994,discuss,0.7656345367431641,"('Scottish', 'NATIONALITY', 1)('War', 'CAUSE_OF_DEATH', 1)('of', 'MISC', 1)('Independence', 'MISC', 1)('1296', 'DATE', 1)('to', 'DATE', 1)('1328', 'DATE', 1)('principal', 'TITLE', 1)('war', 'CAUSE_OF_DEATH', 1)('Scotland', 'COUNTRY', 1)"
1946,LOWER GRADE,HISTORY,1,,"Write notes on two of the following: Canute, David I, the Third Crusade, Simon de Montfort, the Peasants’ Revolt, Joan of Arc.",12.62,9.5,8.8,15,0,0,15,0.0,reason,0.9879112243652344,"('two', 'NUMBER', 1)('Canute', 'PERSON', 1)('David I', 'PERSON', 1)('Third', 'ORDINAL', 1)('Simon de Montfort', 'PERSON', 1)('Peasants', 'MISC', 1)('’', 'MISC', 1)('Revolt', 'MISC', 1)('Joan', 'PERSON', 1)"
1946,LOWER GRADE,HISTORY,1,,In what ways did conditions in Scotland improve during the reign of James IV?,11.1,6.4,8.46,7,1,0,6,0.4404,describe,0.9630501866340636,"('Scotland', 'COUNTRY', 1)('James IV', 'PERSON', 1)"
1946,LOWER GRADE,HISTORY,1,,State the main causes of the English Reformation and describe briefly the various stages of the movement down to,10.4,8.3,9.71,10,0,0,10,0.0,argue,0.3981456458568573,"('English', 'NATIONALITY', 1)('Reformation', 'MISC', 1)"
1946,LOWER GRADE,HISTORY,1,,,0.0,-15.7,0.0,0,0,0,0,0.0,compare,0.3079292476177215,
