year,level,subject,paper,question,text,coleman_liau,flesch_kincaid,gunning_fog,total_tokens,positive_tokens,negative_tokens,neutral_tokens,compound_sentiment_score,intent,intent_certainty,named_entities
1931,HIGHER GRADE,ENGLISH,3,,"Compare two poems by Bridges and Squire regarding subject, language, metre, and mood.",11.57,6.0,8.28,10,0,0,10,0.0,discuss,0.9971283078193665,"('two', 'NUMBER', 1)('Squire', 'PERSON', 1)"
1931,HIGHER GRADE,ENGLISH,3,,Explain Chaucer’s vivid characterization in *The Canterbury Tales*.,13.9,12.3,13.2,6,0,0,6,0.0,describe,0.503664493560791,"('Chaucer', 'PERSON', 1)"
1931,HIGHER GRADE,ENGLISH,3,,Discuss Shakespeare’s portrayal of nature and rural life.,13.9,5.2,8.2,6,0,0,6,0.0,reason,0.994379222393036,"('Shakespeare', 'PERSON', 1)"
1931,HIGHER GRADE,ENGLISH,3,,Analyze Burns’s poetic genres and success.,17.09,8.0,9.07,5,1,0,4,0.5719,reason,0.9954009652137756,"('Burns', 'PERSON', 1)"
1931,HIGHER GRADE,ENGLISH,3,,"Describe *Comus*, *The Progress of Poesy*, *The Lyrical Ballads*, *Adonais*, *The Scholar Gipsy*, or *Dauber*.",13.85,8.0,11.33,10,1,0,9,0.4215,discuss,0.6579393148422241,"('Scholar', 'TITLE', 1)"
1931,HIGHER GRADE,ENGLISH,3,,"Relate a scene from *Gulliver’s Travels*, *The Rivals*, *Pride and Prejudice*, *Esmond*, *David Copperfield*, or *Kidnapped*.",15.29,10.7,13.9,11,1,1,9,-0.0853,discuss,0.8823244571685791,"('David Copperfield', 'PERSON', 1)"
1931,HIGHER GRADE,ENGLISH,3,,Evaluate Addison and Steele as social critics or character creators.,15.19,11.9,20.0,7,0,1,6,-0.2732,reason,0.9273971915245056,"('Addison', 'PERSON', 1)('Steele', 'PERSON', 1)"
1931,HIGHER GRADE,ENGLISH,3,,"Discuss historical episodes in Scott’s novels or compare Scottish life depictions by Scott, Barrie, and Munro.",14.3,11.9,11.4,12,1,0,11,0.3182,reason,0.7203273773193359,"('Scott', 'PERSON', 2)('Scottish', 'NATIONALITY', 1)('Barrie', 'PERSON', 1)('Munro', 'PERSON', 1)"
1931,HIGHER GRADE,ENGLISH,3,,"Describe *Areopagitica*, *On American Taxation*, *Natural History of Selborne*, *Voyage of the Beagle*, *My Schools and Schoolmasters*, or *Memoirs of a Fox-Hunting Man*.",11.64,14.6,16.16,14,1,0,13,0.3612,discuss,0.5821879506111145,"('American', 'NATIONALITY', 1)('Taxation', 'MISC', 1)('Selborne', 'LOCATION', 1)('Fox', 'CAUSE_OF_DEATH', 1)('-', 'CAUSE_OF_DEATH', 1)('Hunting', 'CAUSE_OF_DEATH', 1)"
