year,level,subject,paper,question,text,coleman_liau,flesch_kincaid,gunning_fog,total_tokens,positive_tokens,negative_tokens,neutral_tokens,compound_sentiment_score,intent,intent_certainty,named_entities
1930,HIGHER GRADE,ENGLISH,1,,"Write a Composition, not exceeding three foolscap pages in length, on any one of the following subjects: Lessons by wireless in school; The importance of preserving the beauties of rural Scotland; Which has most benefited mankind—the great soldier, the great scientist, or the great poet? Mary Queen of Scots describes to a friend at the French Court her return to Scotland, and her impressions of that country, its people and its capital.",9.81,15.0,17.18,39,7,0,32,0.5060000000000001,reason,0.8084832429885864,"('three', 'NUMBER', 1)('one', 'NUMBER', 1)('Scotland', 'COUNTRY', 2)('soldier', 'TITLE', 1)('scientist', 'TITLE', 1)('poet', 'TITLE', 1)('Mary Queen of Scots', 'PERSON', 1)('French', 'NATIONALITY', 1)('Court', 'MISC', 1)"
1930,HIGHER GRADE,ENGLISH,1,,"Read the following passage carefully and answer the questions: What is the main theme of this passage, and on what occasion was it suggested to the writer’s mind? Enumerate at least four points which he brings forward in support of the belief he mentions.",9.75,9.5,11.53,22,2,0,20,0.26495,describe,0.4476692378520965,"('writer', 'TITLE', 1)('four', 'NUMBER', 1)"
1930,HIGHER GRADE,ENGLISH,1,,Explain the expressions printed in italics.,11.83,10.4,15.73,4,0,0,4,0.0,reason,0.7462360262870789,
1930,HIGHER GRADE,ENGLISH,1,,Give a general grammatical analysis of the second sentence in the passage.,8.18,10.3,11.47,7,1,0,6,0.0772,reason,0.9070135951042176,"('general', 'TITLE', 1)('second', 'ORDINAL', 1)"
1930,HIGHER GRADE,ENGLISH,1,,"Give the precise meaning of the following words, as used in this passage: stage, infinitely, annually, Parliament, legislators, remote, encamped, courser, salutation, uninhabited, misbecome, courtesy.",14.35,17.8,21.2,19,1,0,18,0.3612,discuss,0.7731314897537231,"('annually', 'SET', 1)('Parliament', 'ORGANIZATION', 1)"
1930,HIGHER GRADE,ENGLISH,1,,"Choose any five of the words quoted and break them into their component parts, giving in each case the force of root and affix.",8.77,7.9,11.27,12,1,0,11,0.34,reason,0.4460853040218353,"('five', 'NUMBER', 1)"
1930,HIGHER GRADE,ENGLISH,1,,"Write three short paragraphs comparing either Canada or Australia with India in point of (1) climate, (2) products, and (3) inhabitants.",12.95,9.1,12.21,16,0,0,16,0.0,reason,0.9121279120445251,"('three', 'NUMBER', 1)('Canada', 'COUNTRY', 1)('Australia', 'COUNTRY', 1)('India', 'COUNTRY', 1)('1', 'NUMBER', 1)('2', 'NUMBER', 1)('3', 'NUMBER', 1)"
1930,HIGHER GRADE,ENGLISH,1,,"Either How were our American colonies founded, and how were they lost? Give dates where you can. Or What is meant by the Industrial Revolution? What inventions brought it about? And what effect did it have on the occupations of the people and the distribution of the population in Great Britain?",7.55,4.9,8.79,19,1,1,17,0.15335,compare,0.732437014579773,"('American', 'NATIONALITY', 1)('Great', 'COUNTRY', 1)('Britain', 'COUNTRY', 1)"
