year,level,subject,paper,question,text,coleman_liau,flesch_kincaid,gunning_fog,total_tokens,positive_tokens,negative_tokens,neutral_tokens,compound_sentiment_score,intent,intent_certainty,named_entities
1935,HIGHER GRADE,HISTORY,1,,"Explain the historical significance of: Mahomet’s career, Synod of Whitby, Seljuk capture of Jerusalem (1071), death of Alexander III of Scotland, Henry VIII’s Act of Supremacy, Solemn League and Covenant, Quebec’s capture, Trafalgar, 1832 Reform Act, First Battle of the Marne (1914).",15.12,20.8,24.42,32,2,3,27,-0.14672,discuss,0.3650911748409271,"('Mahomet', 'PERSON', 1)('Whitby', 'LOCATION', 1)('Seljuk', 'MISC', 1)('Jerusalem', 'CITY', 1)('1071', 'DATE', 1)('Alexander III', 'PERSON', 1)('Scotland', 'COUNTRY', 1)('Henry VIII', 'PERSON', 1)('Solemn', 'MISC', 1)('League', 'MISC', 1)('Covenant', 'RELIGION', 1)('Quebec', 'STATE_OR_PROVINCE', 1)('1832', 'DATE', 1)('Reform', 'MISC', 1)('Act', 'MISC', 1)('First', 'ORDINAL', 1)('1914', 'DATE', 1)"
1935,HIGHER GRADE,HISTORY,1,,"Assess which group left the most permanent mark on Great Britain: Romans, Danes, or Normans. Justify your answer.",10.22,5.6,8.04,12,1,0,11,0.6249,other,0.5907224416732788,"('Great', 'COUNTRY', 1)('Britain', 'COUNTRY', 1)('Danes', 'PERSON', 1)"
1935,HIGHER GRADE,HISTORY,1,,"Explain the importance of two figures: St. Columba, Margaret (Queen of Malcolm Canmore), Thomas à Becket, Frederic Barbarossa, the Black Prince, Joan of Arc.",13.44,6.8,9.8,19,1,0,18,0.3612,reason,0.726362943649292,"('two', 'NUMBER', 1)('St.', 'LOCATION', 1)('Columba', 'LOCATION', 1)('Margaret', 'PERSON', 1)('Queen', 'TITLE', 1)('Malcolm Canmore', 'PERSON', 1)('Thomas à Becket', 'PERSON', 1)('Frederic Barbarossa', 'PERSON', 1)('Black Prince', 'PERSON', 1)('Joan', 'PERSON', 1)"
1935,HIGHER GRADE,HISTORY,1,,Which Tudor monarch contributed most to England’s national welfare? Justify.,15.19,11.9,16.0,7,0,0,7,0.0,other,0.8893339037895203,"('England', 'COUNTRY', 1)"
1935,HIGHER GRADE,HISTORY,1,,Trace Scotland’s Reformation from James V’s death to the Union of the Crowns OR Scotland-England relations from 1603 to,12.89,9.5,11.81,11,0,1,10,-0.5994,discuss,0.6360570192337036,"('Scotland', 'COUNTRY', 1)('James V', 'PERSON', 1)('OR', 'STATE_OR_PROVINCE', 1)('1603', 'DATE', 1)"
1935,HIGHER GRADE,HISTORY,1,,,0.0,-15.7,0.0,0,0,0,0,0.0,compare,0.3079292476177215,
1935,HIGHER GRADE,HISTORY,1,,Discuss Cromwell’s success as rebel vs. failure as ruler OR French influence in English politics (1660–1688) OR contrast Walpole’s and Pitt’s policies OR pre-Industrial Revolution wealth sources.,14.83,8.6,9.84,20,2,2,16,0.1005249999999999,reason,0.7544242739677429,"('Cromwell', 'PERSON', 1)('OR', 'STATE_OR_PROVINCE', 2)('French', 'NATIONALITY', 1)('English', 'NATIONALITY', 1)('1660', 'DATE', 1)('1688', 'DATE', 1)('Walpole', 'CITY', 1)('Pitt', 'PERSON', 1)('pre-Industrial', 'MISC', 1)('Revolution', 'MISC', 1)"
