year,level,subject,paper,question,text,coleman_liau,flesch_kincaid,gunning_fog,total_tokens,positive_tokens,negative_tokens,neutral_tokens,compound_sentiment_score,intent,intent_certainty,named_entities
1934,HIGHER GRADE,GEOGRAPHY,1,,"On the provided map of Great Britain: Identify physical features (Ochil Hills, Mourne Mountains, etc.). Draw railway routes from London to Glasgow. Mark steamship routes and measure distances. Shade coalfields and shipbuilding centers. Insert January/July isotherms.",12.77,4.9,5.1,29,1,0,28,0.6249,discuss,0.4716515243053436,"('Great', 'COUNTRY', 1)('Britain', 'COUNTRY', 1)('Ochil', 'LOCATION', 1)('Hills', 'LOCATION', 1)('Mourne', 'LOCATION', 1)('Mountains', 'LOCATION', 1)('London', 'CITY', 1)('Glasgow', 'CITY', 1)('Mark', 'PERSON', 1)('January', 'DATE', 1)('July', 'DATE', 1)"
1934,HIGHER GRADE,GEOGRAPHY,1,,"On the world map: Label Bolivia, Finland, Siam, Sierra Leone. Mark Bermuda, Formosa, Hawaii, Philippines. Shade densely populated areas and southern deserts. Indicate wheat/rice/cotton production zones. Draw transcontinental railways and solve for place P’s coordinates.",13.91,7.2,9.66,30,1,0,29,0.2023,discuss,0.7408232688903809,"('Bolivia', 'COUNTRY', 1)('Finland', 'COUNTRY', 1)('Siam', 'COUNTRY', 1)('Sierra', 'COUNTRY', 1)('Leone', 'COUNTRY', 1)('Mark Bermuda', 'PERSON', 1)('Formosa', 'ORGANIZATION', 1)('Hawaii', 'STATE_OR_PROVINCE', 1)('Philippines', 'COUNTRY', 1)"
1934,HIGHER GRADE,GEOGRAPHY,1,,Explain latitude determination via Pole Star observation with a diagram.,12.03,13.1,16.0,8,1,0,7,0.4019,reason,0.9146978259086608,"('Pole', 'NATIONALITY', 1)"
1934,HIGHER GRADE,GEOGRAPHY,1,,Describe Mediterranean climate characteristics and plant adaptations.,13.01,17.8,19.94,6,0,0,6,0.0,reason,0.981346309185028,"('Describe', 'MISC', 1)('Mediterranean', 'MISC', 1)"
1934,HIGHER GRADE,GEOGRAPHY,1,,Analyze irrigation-dependent regions and their agricultural systems.,17.52,17.8,19.94,5,0,0,5,0.0,reason,0.9956974983215332,
1934,HIGHER GRADE,GEOGRAPHY,1,,"Explain glacial erosion, transportation, and deposition with local examples.",14.61,11.5,12.49,7,0,0,7,0.0,reason,0.9660168290138244,
1934,HIGHER GRADE,GEOGRAPHY,1,,"Write about 19th-century exploration in Africa, Australia, Arctic, or Antarctic.",15.19,10.7,12.0,7,1,0,6,0.2263,reason,0.9950278401374816,"('about', 'DATE', 1)('19th', 'DATE', 1)('-', 'DATE', 1)('century', 'DATE', 1)('Africa', 'LOCATION', 1)('Australia', 'COUNTRY', 1)('Arctic', 'LOCATION', 1)('Antarctic', 'LOCATION', 1)"
