year,level,subject,paper,question,text,coleman_liau,flesch_kincaid,gunning_fog,total_tokens,positive_tokens,negative_tokens,neutral_tokens,compound_sentiment_score,intent,intent_certainty,named_entities
1932,HIGHER GRADE,ENGLISH,2,,Give an account of a leading character in any play of Shakespeare that you have read. Illustrate from Shakespeare’s plays the various uses to which he puts his power of poetic description. Describe some comic scene in a Shakespearian tragedy or some tragic scene in a Shakespearian comedy and justify its presence in the drama.,10.0,8.1,10.96,28,3,2,23,-0.0154599999999999,discuss,0.6470016241073608,"('Shakespeare', 'PERSON', 2)('Shakespearian', 'MISC', 2)"
1932,HIGHER GRADE,ENGLISH,2,,"What is specially characteristic of its author and of its age in The Canterbury Tales, or The Rape of the Lock, or Tam o’ Shanter, or The Idylls of the King?",9.76,11.8,14.98,12,0,1,11,-0.6908,describe,0.5570917725563049,"('author', 'TITLE', 1)('Tam', 'PERSON', 1)('King', 'TITLE', 1)"
1932,HIGHER GRADE,ENGLISH,2,,"Mention by its title one example of each of the following: elegy, satire, ode, pastoral, masque, epic, dramatic lyric; giving in each case the name of the author, and a brief note on the subject-matter of the work quoted.",10.43,16.1,17.65,22,1,0,21,0.34,discuss,0.4509059190750122,"('one', 'NUMBER', 1)('author', 'TITLE', 1)"
1932,HIGHER GRADE,ENGLISH,2,,Write on Bacon as an essayist or on Dr. Johnson as a conversationalist or on Matthew Arnold as a critic of poetry.,9.92,6.4,8.04,10,0,1,9,-0.2732,reason,0.9915751814842224,"('Bacon', 'PERSON', 1)('Johnson', 'PERSON', 1)('Matthew Arnold', 'PERSON', 1)('critic', 'TITLE', 1)"
1932,HIGHER GRADE,ENGLISH,2,,"Either illustrate from their works the humour of any two of the following: Addison, Goldsmith, Scott, Jane Austen, George Eliot, Dickens, G. K. Chesterton, Bernard Shaw. Or point out what you consider to be the chief merits and defects of either Scott as a novelist or Carlyle as a critic.",11.41,7.4,9.08,29,2,2,25,0.07125,discuss,0.8858093023300171,"('two', 'NUMBER', 1)('Addison', 'PERSON', 1)('Goldsmith', 'PERSON', 1)('Scott', 'PERSON', 2)('Jane Austen', 'PERSON', 1)('George Eliot', 'PERSON', 1)('Dickens', 'PERSON', 1)('G. K. Chesterton', 'PERSON', 1)('Bernard Shaw', 'PERSON', 1)('novelist', 'TITLE', 1)('Carlyle', 'PERSON', 1)('critic', 'TITLE', 1)"
1932,HIGHER GRADE,ENGLISH,2,,"Choose any one of the following and discuss its importance in English literary history: Milton’s Paradise Lost, The Songs of Burns, Macaulay’s History of England, Lyrical Ballads.",11.41,13.8,15.24,18,2,1,15,0.2266333333333333,reason,0.8370876908302307,"('one', 'NUMBER', 1)('English', 'NATIONALITY', 1)('Milton', 'PERSON', 1)('Burns', 'PERSON', 1)('Macaulay', 'PERSON', 1)('England', 'COUNTRY', 1)"
