year,level,subject,paper,question,text,coleman_liau,flesch_kincaid,gunning_fog,total_tokens,positive_tokens,negative_tokens,neutral_tokens,compound_sentiment_score,intent,intent_certainty,named_entities
1929,HIGHER GRADE,GEOGRAPHY,1,,"Describe the part of the county shown, with careful reference to the sites of the villages and other settlements. Why is the coastal strip scantily peopled and what occupations are the inhabitants likely to follow? ",9.02,7.8,11.57,17,1,0,16,0.1531,explain,0.5536573529243469,
1929,HIGHER GRADE,GEOGRAPHY,1,,"Compare the course of the main railway and the accompanying highroad so far as they are shown on the map, pointing out the main differences between the line followed in the two cases. Show, by any method you please, the precise difference in gradient between the two in the regions where they diverge most widely.",9.81,10.5,12.45,26,1,0,25,0.3182,discuss,0.9963679313659668,"('two', 'NUMBER', 2)"
1929,HIGHER GRADE,GEOGRAPHY,1,,"Give a careful geographical description, illustrated by a sketch-map, either of N.E. England ",12.78,9.5,14.43,9,1,0,8,0.1531,reason,0.491750419139862,"('N.E.', 'LOCATION', 1)('England', 'COUNTRY', 1)"
1929,HIGHER GRADE,GEOGRAPHY,1,,"hat is, the area to the east of the Pennines between the Tweed and the Humber), or of Ireland, north of a line from Donegal Bay to Dundalk Bay.",5.29,8.7,11.6,13,0,0,13,0.0,discuss,0.6656016111373901,"('Ireland', 'COUNTRY', 1)('Donegal', 'CITY', 1)('Bay', 'CITY', 2)('Dundalk', 'CITY', 1)"
1929,HIGHER GRADE,GEOGRAPHY,1,,"Compare the east and west coasts of Scotland, north of a line from Forth to Clyde, as to climate, products and occupations of the inhabitants, and account for the differences between them.",9.17,13.4,16.55,15,0,0,15,0.0,discuss,0.9971509575843812,"('Scotland', 'COUNTRY', 1)('Clyde', 'PERSON', 1)"
1929,HIGHER GRADE,GEOGRAPHY,1,,"Describe the characters of the chief vegetation belts of Europe, and relate their distribution to the various types of climate represented in the continent.",12.06,13.8,17.93,13,0,0,13,0.0,reason,0.4320686757564544,"('Europe', 'LOCATION', 1)"
1929,HIGHER GRADE,GEOGRAPHY,1,,"Explain in detail how you would use either (1) a prismatic compass to make a survey of a winding road, or (2) a plane table to make a sketch-map of a small area.",9.58,11.4,14.41,19,0,0,19,0.0,reason,0.8819279670715332,"('1', 'NUMBER', 1)('2', 'NUMBER', 1)"
1929,HIGHER GRADE,GEOGRAPHY,1,,"Name the chief coalfields of continental Europe, indicate the outstanding industries carried on on each field mentioned, and point out the advantages which favour these in each case.",10.66,13.0,18.34,15,3,0,12,0.4342666666666666,discuss,0.7310568690299988,"('Europe', 'LOCATION', 1)"
