year,level,subject,paper,question,text,coleman_liau,flesch_kincaid,gunning_fog,total_tokens,positive_tokens,negative_tokens,neutral_tokens,compound_sentiment_score,intent,intent_certainty,named_entities
1932,Higher,HISTORY,1,1,"Show very briefly the historical significance of five of the following: the career of Penda of Mercia, the marriage of Henry II, the death of Alexander III, the battle of Bosworth, the voyages of Columbus, the Grand Remonstrance, the Stamp Act, Napoleon’s invasion of Russia, the career of Garibaldi, the Franco-Prussian war, the Parliament Act, the Statute of Westminster ([1931]).",12.93,26.7,30.0,35,2,3,30,-0.16972,discuss,0.387704461812973,"('five', 'NUMBER', 1)('Mercia', 'LOCATION', 1)('Henry II', 'PERSON', 1)('Alexander III', 'PERSON', 1)('Bosworth', 'ORGANIZATION', 1)('Columbus', 'CITY', 1)('Grand', 'MISC', 1)('Remonstrance', 'MISC', 1)('Stamp', 'MISC', 1)('Act', 'MISC', 2)('Napoleon', 'PERSON', 1)('Russia', 'COUNTRY', 1)('Garibaldi', 'PERSON', 1)('Franco', 'MISC', 1)('-', 'MISC', 1)('Prussian', 'MISC', 1)('war', 'CAUSE_OF_DEATH', 1)('Parliament', 'MISC', 1)('1931', 'DATE', 1)"
1932,Higher,HISTORY,1,2,Contrast the influence upon this country of the Roman Occupation and the invasions of the Danes and Scandinavians.,10.67,11.5,16.09,9,0,0,9,0.0,discuss,0.992671012878418,"('Roman', 'MISC', 1)('Occupation', 'MISC', 1)('Scandinavians', 'MISC', 1)"
1932,Higher,HISTORY,1,3,What were the chief causes of quarrel between Church and State from the Norman Conquest to the death of Edward I?,8.44,6.8,8.4,9,0,1,8,-0.5994,compare,0.7129451036453247,"('Church', 'ORGANIZATION', 1)('and', 'ORGANIZATION', 1)('State', 'ORGANIZATION', 1)('Norman Conquest', 'PERSON', 1)('Edward I', 'PERSON', 1)"
1932,Higher,HISTORY,1,4,How far is it true to say that the relations of England and Scotland were friendly during the two centuries which preceded the War of Independence?,8.57,11.1,15.02,12,2,1,9,0.1053333333333333,describe,0.7108131051063538,"('England', 'COUNTRY', 1)('Scotland', 'COUNTRY', 1)('the', 'DURATION', 1)('two', 'DURATION', 1)('centuries', 'DURATION', 1)('War', 'CAUSE_OF_DEATH', 1)('of', 'MISC', 1)('Independence', 'MISC', 1)"
1932,Higher,HISTORY,1,5,What motives led Edward III and Henry V to attempt the conquest of France? What help did the French receive from Scotland?,10.64,2.9,4.4,13,1,0,12,0.4019,compare,0.994442880153656,"('Edward III', 'PERSON', 1)('Henry V', 'PERSON', 1)('France', 'COUNTRY', 1)('French', 'NATIONALITY', 1)('Scotland', 'COUNTRY', 1)"
1932,Higher,HISTORY,1,6,Give some account of the Peasants’ Revolt and the struggle between James II and the House of Douglas.,9.79,5.6,7.2,9,0,1,8,-0.3182,reason,0.6933543086051941,"('James II', 'PERSON', 1)('House', 'ORGANIZATION', 1)('of', 'ORGANIZATION', 1)('Douglas', 'ORGANIZATION', 1)"
1932,Higher,HISTORY,1,7,What events decreased the power of the Papacy between the death of Innocent III and the capture of Constantinople by the Turks?,10.47,7.2,10.62,10,1,1,8,-0.1297,compare,0.9857324957847596,"('III', 'NUMBER', 1)('Turks', 'MISC', 1)"
1932,Higher,HISTORY,1,8,"Compare the causes of the Reformation in England and the Reformation in Scotland, and the circumstances in which they took place.",8.44,10.3,12.21,9,0,0,9,0.0,discuss,0.9971495270729064,"('England', 'COUNTRY', 1)('Scotland', 'COUNTRY', 1)"
1932,Higher,HISTORY,1,9,Trace the relations between England and Spain from the death of Edward VI to the death of James VI and I.,9.19,6.8,10.3,10,0,2,8,-0.5994,discuss,0.7740859985351562,"('England', 'COUNTRY', 1)('Spain', 'COUNTRY', 1)('Edward VI', 'PERSON', 1)('James VI', 'PERSON', 1)"
1932,Higher,HISTORY,1,10,"Illustrate and account for the origin and development of the English Colonies in the 17th century, or explain the importance in Scottish History of the National Covenant of [1638] and the Solemn League and Covenant.",11.24,16.9,19.71,18,1,1,16,0.142,discuss,0.6697145104408264,"('English', 'NATIONALITY', 1)('Colonies', 'MISC', 1)('the', 'DATE', 1)('17th', 'DATE', 1)('century', 'DATE', 1)('Scottish', 'NATIONALITY', 1)('Covenant', 'RELIGION', 2)('1638', 'DATE', 1)('Solemn', 'MISC', 1)('League', 'MISC', 1)"
1932,Higher,HISTORY,1,11,"Discuss one of the following topics: the intervention of France in the Thirty Years’ War, the Parliaments of the Commonwealth and Protectorate, the foreign policy of Charles II, the causes of the Revolution of [1688]-[1689].",12.59,15.8,19.71,19,0,1,18,-0.5994,reason,0.993081033229828,"('one', 'NUMBER', 1)('France', 'COUNTRY', 1)('the', 'DURATION', 1)('Thirty', 'DURATION', 1)('Years', 'DURATION', 1)('War', 'CAUSE_OF_DEATH', 1)('Commonwealth', 'ORGANIZATION', 1)('Charles II', 'PERSON', 1)('1688', 'DATE', 1)('1689', 'DATE', 1)"
1932,Higher,HISTORY,1,12,"Contrast the aims and the policy of Walpole, the elder Pitt, and Lord Bute.",11.1,4.0,5.6,8,0,0,8,0.0,discuss,0.99472177028656,"('Walpole', 'CITY', 1)('Pitt', 'PERSON', 1)('Bute', 'PERSON', 1)"
1932,Higher,HISTORY,1,13,When and how did British colonial policy abandon the principles which had led to the loss of the American colonies? Illustrate your answer from the history of Canada.,8.84,7.6,8.46,13,0,2,11,-0.3792999999999999,describe,0.8134971857070923,"('British', 'NATIONALITY', 1)('American', 'NATIONALITY', 1)('Canada', 'COUNTRY', 1)"
1932,Higher,HISTORY,1,14,Indicate the causes which produced a large increase in the national wealth in the years between [1763] and [1832].,11.23,7.2,11.81,10,2,0,8,0.40605,describe,0.683382511138916,"('the', 'DURATION', 1)('years', 'DURATION', 1)('1763', 'DATE', 1)('1832', 'DATE', 1)"
1932,Higher,HISTORY,1,15,"Discuss one of the following topics: sea power in the Great French War ([1793]-[1815]), the settlement of Europe after Waterloo, the influence of either John Henry Newman or Thomas Chalmers upon the religious movements in the second quarter of the [19th] century, the development of British South Africa since [1815].",12.12,20.4,23.2,33,1,1,31,0.0127499999999999,reason,0.9924926161766052,"('one', 'NUMBER', 1)('Great', 'MISC', 1)('French', 'NATIONALITY', 1)('War', 'CAUSE_OF_DEATH', 1)('1793', 'DATE', 1)('1815', 'DATE', 2)('Europe', 'LOCATION', 1)('Waterloo', 'CITY', 1)('John Henry Newman', 'PERSON', 1)('Thomas Chalmers', 'PERSON', 1)('the', 'DATE', 2)('second', 'DATE', 1)('quarter', 'DATE', 1)('of', 'DATE', 1)('[', 'DATE', 1)('19th', 'DATE', 1)(']', 'DATE', 1)('century', 'DATE', 1)('British', 'NATIONALITY', 1)('South', 'COUNTRY', 1)('Africa', 'COUNTRY', 1)"
1932,Higher,HISTORY,1,16,Give some account of the causes of the Indian Mutiny and of the constitutional changes that followed it.,8.92,8.0,9.42,8,0,0,8,0.0,reason,0.8677341938018799,"('Indian', 'NATIONALITY', 1)('Mutiny', 'MISC', 1)"
1932,Higher,HISTORY,1,17,"Trace the career, and estimate the achievements, of one of the following statesmen: George Canning, Sir Robert Peel, Benjamin Disraeli, William Ewart Gladstone.",13.02,12.3,12.68,17,0,0,17,0.0,reason,0.3672769069671631,"('one', 'NUMBER', 1)('George Canning', 'PERSON', 1)('Robert Peel', 'PERSON', 1)('Benjamin Disraeli', 'PERSON', 1)('William Ewart Gladstone', 'PERSON', 1)"
1932,Higher,HISTORY,1,18,Compare the causes of the fall of the Emperor Napoleon III with those of the fall of the Emperor William II of Germany.,9.58,9.9,14.42,11,0,0,11,0.0,discuss,0.9972545504570008,"('fall', 'DATE', 2)('Emperor', 'TITLE', 2)('Napoleon III', 'PERSON', 1)('William II', 'PERSON', 1)('Germany', 'COUNTRY', 1)"
1932,Higher,HISTORY,1,19,"Give some account of one of the following: the new European States created by the Treaty of Versailles ([1919]), the influence of the Great War upon the status of the British Overseas Dominions.",10.06,12.6,14.41,19,2,1,16,0.0918333333333333,discuss,0.4076321721076965,"('one', 'NUMBER', 1)('European', 'NATIONALITY', 1)('States', 'MISC', 1)('Versailles', 'CITY', 1)('1919', 'DATE', 1)('Great', 'MISC', 1)('War', 'CAUSE_OF_DEATH', 1)('British', 'NATIONALITY', 1)"
