year,level,subject,paper,question,text,coleman_liau,flesch_kincaid,gunning_fog,total_tokens,positive_tokens,negative_tokens,neutral_tokens,compound_sentiment_score,intent,intent_certainty,named_entities
1930,LOWER GRADE,GEOGRAPHY,1,,"On the accompanying map of Scotland: Name Arran, Mull, Islay and Bute. Mark and name the Forth and Clyde canal, the Crinan canal and the Caledonian canal.",9.57,6.2,8.36,17,0,0,17,0.0,discuss,0.8634410500526428,"('Scotland', 'COUNTRY', 1)('Name', 'MISC', 1)('Arran', 'MISC', 1)('Islay', 'LOCATION', 1)('Mark', 'PERSON', 1)('Clyde', 'PERSON', 1)('Crinan', 'MISC', 1)('Caledonian', 'MISC', 1)"
1930,LOWER GRADE,GEOGRAPHY,1,,"Mark and name the towns of Grangemouth, Kirkcaldy, Inverness, Dumfries and Montrose; and name the rivers Tweed, Spey, Nith, Findhorn and Don, and Lochs Lomond, Long, Fyne, Ness and Rannoch.",14.07,11.5,14.67,20,0,0,20,0.0,discuss,0.4631521105766296,"('Mark', 'PERSON', 1)('Grangemouth', 'LOCATION', 1)('Kirkcaldy', 'LOCATION', 1)('Inverness', 'CITY', 1)('Dumfries', 'CITY', 1)('Montrose', 'CITY', 1)('Spey', 'LOCATION', 1)('Nith', 'PERSON', 1)('Don', 'PERSON', 1)('Lochs Lomond', 'PERSON', 1)('Fyne', 'PERSON', 1)('Ness', 'PERSON', 1)('Rannoch', 'PERSON', 1)"
1930,LOWER GRADE,GEOGRAPHY,1,,"Draw, with careful reference to relief, two railway routes from Glasgow to Carlisle. Mark and name the latter town and one intermediate station on each route shown.",8.98,7.4,8.36,18,2,0,16,0.3149,discuss,0.8818339109420776,"('two', 'NUMBER', 1)('Glasgow', 'CITY', 1)('Carlisle', 'CITY', 1)('Mark', 'PERSON', 1)('one', 'NUMBER', 1)"
1930,LOWER GRADE,GEOGRAPHY,1,,"Shade and name on the map one area producing large quantities of small fruits, one yielding granite, and one in which water has been or is being utilised to generate hydro-electric power. Print F on the first area, G on the second, and P on the third.",8.83,8.9,11.95,27,0,0,27,0.0,discuss,0.8639782071113586,"('one', 'NUMBER', 3)('first', 'ORDINAL', 1)('second', 'ORDINAL', 1)('third', 'ORDINAL', 1)"
1930,LOWER GRADE,GEOGRAPHY,1,,"On the accompanying map of North and Central America: Name Long Island, Newfoundland, Cuba, Lake Winnipeg and Hudson Bay; and mark and name the towns of Toronto, St. Louis, Boston, Mexico City and Buffalo.",10.05,7.6,9.15,24,0,0,24,0.0,discuss,0.8821032643318176,"('North', 'LOCATION', 1)('Central', 'LOCATION', 1)('America', 'COUNTRY', 1)('Long', 'CITY', 1)('Island', 'LOCATION', 1)('Newfoundland', 'STATE_OR_PROVINCE', 1)('Cuba', 'COUNTRY', 1)('Lake', 'LOCATION', 1)('Winnipeg', 'CITY', 1)('Hudson', 'CITY', 1)('Bay', 'CITY', 1)('Toronto', 'CITY', 1)('St.', 'LOCATION', 1)('Louis', 'LOCATION', 1)('Boston', 'CITY', 1)('Mexico', 'COUNTRY', 1)('City', 'LOCATION', 1)('Buffalo', 'CITY', 1)"
1930,LOWER GRADE,GEOGRAPHY,1,,"Shade one area producing large amounts of raw cotton, one producing tobacco, one producing maize and one producing timber. In each case print the name of the product and of the area intended close to the shading, and in each case mark and name a town which serves as a collecting centre for the product.",8.16,10.5,13.18,33,0,0,33,0.0,discuss,0.5367854833602905,"('one', 'NUMBER', 4)('tobacco', 'CAUSE_OF_DEATH', 1)"
1930,LOWER GRADE,GEOGRAPHY,1,,"Insert on the map five dotted lines marking the limits of the time zones, that is of the belts within which standard time differs from that of Greenwich by 4, 5, 6, 7 and 8 hours respectively. Number the lines in sequence from east to west and also insert and name the tropic of Cancer and the Arctic Circle.",10.99,11.3,12.48,34,2,1,31,-0.0808333333333333,discuss,0.6630423069000244,"('five', 'NUMBER', 1)('Greenwich', 'CITY', 1)('4', 'NUMBER', 1)('5', 'NUMBER', 1)('6', 'NUMBER', 1)('7', 'NUMBER', 1)('8', 'DURATION', 1)('hours', 'DURATION', 1)('tropic', 'MISC', 1)('of', 'MISC', 1)('Cancer', 'CAUSE_OF_DEATH', 1)('Arctic', 'LOCATION', 1)('Circle', 'LOCATION', 1)"
